li-xing-6-47,赞同了回答,1592208755,2020-06-15 16:12:35,1270273019,为什么大家对东北人的印象不好呢？,"昨天举报一个辱骂东北人的知乎号成功，知乎反应挺快，毕竟那人几乎就是标题骂街。虽然如此，心里还是有些火气的，评论的时候带些情绪，结果被封了一天。所以就来探讨一下这个问题。个人好旅游，去某个城市之前总是喜欢在网上先探探路。有次想去某海港城市，结果一问之下有个当地人恶语相向，我问他原因何在，记得他气愤愤的说，你们东北人在海边都干了些什么你们自己不知道么。我怎么可能会知道。然后我用最简单的逻辑捋了一下：请问那些东北人是否有违法行为，如果违法，当地执法机关为什么不处理，总归不能是被东北人控制了吧。如果他们违法，你们不处理，本地的问题更大吧。如果那些人没有违法，那你说再多有什么用呢，东北人不是中国人么，中国人难道不能去中国人的地方？再退一步说，东北人在外地无论如何是占少数的，你们当地人居然就无可奈何，只能在网上骂人，这也说不过去了吧。这道理太浅显了，所以别有用心者改变策略，就是意图证明东北人不是中国人。知乎曾经看过不止一个非东北人质问网上东北人为什么会有分裂言论，说河南人被黑了这么多年也没说什么。问题是有人拿异族汉奸这种言论来攻击河南了么，没有的。观察者网是著名爱国网站，不是讽刺，也不想讨论这个问题。可是那里地域黑同样猖獗，一次在辩论东北人是否爱吃野味的问题的时候，某人就一口一个东百如何如何，我就试探了他一下。我说一亿多东北人是什么人，你说的不算，我说的不算，认为自己能说的算的都是P,结果他果然恼羞成怒，破口大骂，被迅速处理。能被迅速处理，应该是因为现在的观网有东北小编。这就涉及另一个问题，有一部分人想把东北人标签化，定义化。这个方法目前看来已经颇具成效，因为很多东北人有意无意的在配合。美国就用这种方法来统治黑人，把吸毒脏口等等恶习说成黑人文化，把黑人定义化，标签化。喊麦风行的时候，臧鸿飞说东北人像黑人，就是这个意思。东北人应该警惕，大碴子，烧烤是饮食文化，无可厚非，但东北人真就都喜欢大金链子穿貂皮喊麦么，是这么回事么。那这些人想干什么呢，知乎说法很多。个人也不想探讨。不过要说一个亲身经历的事情。个人去年生病回老家，发现老家的抗联遗址被整修一新，还有专人看护，攀谈之下了解到，自从八年抗战改为十四年抗战后，全国各地的官方吊唁络绎不绝，中央党校一年至少要来两次以上。这事或许说明不了太多，但是至少证明高层是重视的。对比高层精英人员，你不管怎么说吧，网上地域黑真就是P.老家的抗联遗址有一座烈士纪念碑，埋葬了一位义士，可他根本就不是中国人，他是朝鲜人，但是因为抗日牺牲在东北，我们没有忘记他，给他立了碑。这才是中国人的胸怀和气度，那些说杨靖宇是河南人，被东北人出卖的网络喷子，你们不羞耻么。杨将军的具体战斗事迹主要都是几个贴身警卫员记录下来的，比如王传圣黄生发。将军殉国之前，身边最后两个不满十八岁的警卫员就已经牺牲。他们都是纯粹的本地人，就像出卖将军也是本地人一样，这在当时中国，本来就是常态。无论是共产主义理想还是爱国主义情操，杨将军怎么可能会考虑籍贯这种荒谬的问题，他和身边的战士本来就是用鲜血和生命来救中国，而你们却在试图分裂中国。不过个人这种消极懒散之人都受到刺激，可见他们攻击效果之大。那作为一个普通东北人，该如何面对当下的局面呢。说一下纯粹的个人观点。那就是有志的东北人要做好自己，不要管他们的印象好或者不好，不要被标签化，我们就算是努力生活的普通人，也跟街头混子不一样，不喜欢的就主动拒绝，保持距离。鲁迅先生说：我们从古以来，就有埋头苦干的人，有拼命硬干的人，有为民请命的人，有舍身求法的人，……虽是等于为帝王将相作家谱的所谓“正史”，也往往掩不住他们的光耀，这就是中国的脊梁。东北人毫无疑问是这片土地上堂堂正正的中国人，我们做好自己就好了。不被挑唆，不被定义，也就不用在乎别人印象。那些喊瑞典的，东百的，他们真的以为自己有多大能量呢，虽然他们背后的能量可能很大。至于东北人中的败类，自有法律和公序良俗，如果两者不彰，我们有志气者就应该去维护和建设。李敖大师生前多次引用某台湾志士的话试图教诲岛民，那位志士是这么说的的，大陆的土地和资源也是每个生在台湾的中国人的，不要小看自己（大意）。就是这样，哪里有什么关内关外，这都是中国的土地，属于每一个中国人。对于现实中存在的问题，真的有志气有本事，那就埋头苦干拼命硬干，如果情况恶化，那就为民请命舍身求法。我承认这是高调，但是唐太宗说过：取法于上，仅得为中，取法于中，故为其下。就算力有不逮，也不可自甘下流，所以不必匿名。","东北人,东北话,东北"
li-xing-6-47,回答了问题,1592198391,2020-06-15 13:19:51,1284092063,为什么我作为法学生会觉得有些律师挺恶心的？,等你从业以后，你就知道，这个行业里比这个恶心的有的是！,"律师,法学,律师行业,快手,抖音"
li-xing-6-47,回答了问题,1591953526,2020-06-12 17:18:46,1279341183,我是一个头婚女，现在23岁，男朋友比我大十岁，且有个五岁的小闺女，孩子是男朋友妈妈带，嫁他会幸福吗？,想啥呢？！肯定不会啊！你幸福才叫见鬼了。我这样说不是因为你男朋友大你十岁，也不是因为他离过婚有孩子，而是因为你连接受这份感情的魄力都没有，你咋可能幸福？你如果可以走入婚姻，周围嚼舌头的闲人可比知乎上多多多了，这你都开始无所适从了，这心理素质，你还是拉倒吧！万一你再过得不好，周围的人肯定比过年还高兴：你看！你看！我就说吧………你要想得到普遍认可，那就去找一份理所应当感情，按部就班的结婚生子，平平安安。你要想特立独行，那就别问，因为很少人会支持特立独行，你纯属找不自在。,"婚姻,离异,23岁,二婚家庭,二婚男 "
li-xing-6-47,回答了问题,1591938847,2020-06-12 13:14:07,1278874226,如何评价面孔乐队的主唱陈辉？,我是面孔乐队20周年演唱会的时候，在“愚公移山”酒吧，才看到陈辉本人。当时陈辉梳着丸子头，戴着黑框眼镜出场的时候，我一看，OMG，一点都没变啊！因为我算了算，如果面孔成军二十周年，那辉哥也得也有四十多了，但是感觉还和《火的本能》内页里的照片一样，一点也不显老。最关键是，居然声线还是那么高亢，也没有显得苍老（好像同时代的齐秦和丁武，唱高音已经有点吃力了）。,"摇滚乐,金属乐,死亡金属（Death Metal）,乐队的夏天（综艺）"
li-xing-6-47,回答了问题,1591924119,2020-06-12 09:08:39,1278383544,高一了想知道学习重要还是朋友重要？,劝你不要以身犯险，但是你如果非要试试，我也不拦着。你可以试试，你高考落榜，去复读，或者去打工以后，看看那些已经上大学走了的小伙伴，还拿你当朋友不？,"高一,高中在校,高中烦恼"
li-xing-6-47,赞同了回答,1591840317,2020-06-11 09:51:57,1212445170,在打官司时，明明对方是违法的，却还是能请律师来，在律师的辩护下，反方竟然赢了，这不算是颠倒黑白吗?,如果你说对方违法对方就违法，那还要法院干什么？你自己判不就行了？,"法律,律师,诉讼,打官司,律师行业"
li-xing-6-47,赞同了回答,1591778988,2020-06-10 16:49:48,1274742404,30 天打卡挑战：在你心中，排名前五的武侠片是哪些？为什么？,"侠之大者,为国为民,侠之小者,为友为邻――――梁启超优秀的武侠片是在是太多了，如果要挑出5部的话，我选择以下这五部，排名不分先后。《笑傲江湖2：东方不败》《新龙门客栈》《剑雨》《卧虎藏龙》《英雄》李连杰 林青霞《笑傲江湖2：东方不败》这个版本的笑傲江湖是我最喜欢的版本，没有之一。皇图霸业谈笑中，不胜人生一场醉。初见张曼玉 林青霞 梁家辉《新龙门客栈》张曼玉演的金镶玉双目含情摄魂，言语风尘轻佻，性格时而泼辣，时而柔情，不拘小节，不吃大亏，最后却为爱情倾尽所有。金镶玉站在龙门客栈房顶上，周淮安问她：龙门客栈在哪？她扭着腰身答道：在我身上。摄魂双目杨紫琼 《剑雨》江湖归根到底还是人的江湖，而人，都是为情而活。我愿化身石桥，为你受五百年风吹，五百年日晒，五百年雨打，只为你从桥上走过。整部电影的画质都十分细腻周润发 章子怡 杨紫琼 《卧虎藏龙》电影中的打斗场景是武侠片中最唯美的，配上舒缓的音乐，看电影成为了一种别样的享受。我并没有得道的喜悦，相反地，却被一种寂灭的悲哀环绕。最美眼神张艺谋 《英雄》一部将色彩运用到极致的电影，一部将古典文化融汇到武侠中的电影，一部波澜壮阔的侠义史诗。一个人的痛苦，与天下相比，便不再是痛苦。赵国与秦国的仇恨，放到天下，便不再是仇恨。屏保如果你也喜欢的话，点个赞再走吧。","电影,影视,电视剧,武侠电影,30天不断片挑战"
li-xing-6-47,赞同了回答,1591771274,2020-06-10 14:41:14,1069552467,渣女是怎样玩弄男人的呢？,谢邀！前几天正好写过一篇类似的文章。先简要梳理一下渣女操作的大体流程。懂他，顺从与崇拜满足男性内心需求 男性感觉很爽并产生依赖 男性想要持续爽引导男性付出获利离场或继续获取更多利益首先让我们来分析分析渣女一系列骚操作的外在表现和内在成因。人性都是自私的。正常择偶的时候我们都会本能的把自我的需求放在首位，而渣女们伪装了一身无私的外衣，为了更远大的目标，而假意把对方的需求放在首位，并为其定制了一套专属方案，让男人如获至宝般的发现了一个懂我爱我，处处以我为先的女孩，简直是灵魂伴侣有木有。等到男生彻底依赖上了，就是她们收割成果的时候了，如果男生家庭条件和未来发展不好，她们可能会选择获利离场，而如果男生条件很好，他们可能就会选择继续经营关系获取更大的利益，甚至是婚姻。这时候我们会发现几个问题。1、为什么渣女们可以做到在感情中如此理性？2、为什么渣女能够知道不同男性的不同需求，并对症下药？3、为什么男生甘愿被收割？首先让我们看第一个问题，为什么渣女们可以做到在感情中如此理性。渣女在感情上如此理性，除了少数天赋异禀者，其他大多数原因包括：1、恋爱经历够多，而把感情看得很透，觉得亲密关系的本质不过是披着爱情外衣的利益互换。2、由于经历太多，边际效益递减原理，现在的她们对感情已经没有那么大的需求，那就不如换取一些实际的好处了。3、自身条件较差且欲望很强，迫切想要改变命运与阶层，却不足以依靠个人实力实现目标，于是通过婚恋来获取资源就成了一个很好的模式。在渣女们的世界，感情就是交换，前期情绪价值的付出就是为了后期的获益，所以她们相当具有服务客户的思维，以对方的需求为己任，这让男生前期拥有了物超所值的体验感。同时由于是交换自然没有开心痛苦纠结不安等等影响决策的情绪。无论是为了满足对方虚荣心而表现出的温柔依赖，还是为了让对方患得患失而表现出的若即若离，不过都是根据场景不同的配合演出，她们无情无爱，情绪稳定。她们之所以能如此下手稳准狠，其核心因素是她们从心理层面和价值观层面早已实现闭环，前期投入，全情表演，吸引顾客，后期收割韭菜都是凭着自己的本事，所以并不会产生一点舍不得或是负罪感。那么让我们来看第二个问题，为什么渣女能够知道不同男性的不同需求，并对症下药？渣女反复恋爱实践，对男性拥有如大数据一般丰富的了解经验，再加上想要获利的欲望使得她们反复对大数据进行深度挖掘，并形成一整套针对不同男性的应对策略。她们甚至比男人还要了解男人，她们可以从言谈举止中挖掘男人隐秘的情感，男人心中的梦想，男人不为人知的创伤，男人难以启齿的欲望。于是她们开始了降维打击，如同高中生来做小学生的题，无论你是加法还是减法，你是乘法还是除法，她们全都会。但是在个体男生眼里，哇，好幸运啊，她居然正好会我这一题，她还知道我做题的痛苦，她还夸我聪明，她怎么这么懂我呢？还那么的爱我崇拜我，这不是命中注定是什么？而与此同时渣女还会根据双方发展的进程，男方反馈信息等情况，不停调节应对策略，若即若离、推拉弹唱，手到擒来。那么让我们再来看第三个问题，为什么男生甘愿被收割？首先我先说一个想吃胡萝卜的驴的故事。从前有一只驴，头前栓了根胡萝卜，驴之所以会拉磨，因为有欲望，有想吃胡萝卜的欲望，特别是之前尝过一口胡萝卜，那就更是欲罢不能了。而这根成了精的胡萝卜经验纯熟，驴走的慢了，就荡到嘴边，仿佛一伸头就能吃到，驴实在不想走了，就让驴有机会舔一口胡萝卜。可驴一直就是很难完全吃到这根胡萝卜。有时甚至它都开始怀疑驴生，之前那胡萝卜明明那么喜欢让自己吃，没理由现在突然变了啊？肯定是我没有做好，是不是自己走的还不够快？是不是自己走错了方向？更有厉害的胡萝卜又牵来几头驴，驴一看这胡萝卜太抢手了，自己要不飞奔起来，岂不是要给别的驴吃了？这时哪怕吃不到胡萝卜，只要胡萝卜离自己比别人嘴边近点，便也满满的满足感。于是驴不再是被动拉磨，而是在争着抢着拉磨了。亲爱的蓝孩纸们，驴器大活好，我在夸你们O(∩_∩)O哈！所以渣女们在前期关系中，短暂大量释放情绪价值，一旦当男生认定渣女是灵魂伴侣，上钩时，也就是完全被渣女掌握这段关系的主导权，开始收割的时候了。低端的渣女会撒娇卖萌获得自己想要的，高端渣女会旁敲侧击引导男生，甚至对战利品半推半就，让男生们以为物质金钱那些肮脏的东西都是自己硬塞给她的，她分明是个纯洁的小天使。她们会控制你的情绪，突然变冷让你很难适应，拼命思考自己是不是做错了什么，冷热交替让你患得患失，心态崩溃，打你一巴掌，再给你个糖，由不得你不怀疑人生。更高阶的甚至引来竞争者，让你在被收割时还能收获成就感，怎么样，那么多人想被收割，可我最终取得了胜利，她只收割我哎，你说厉不厉害。你想问为什么她可以做到，因为渣女不爱你啊，她对你莫得感情，只有交换，无论前期后期，无论热情冷淡，她想怎么演就怎么演，可你居然却当做了真情。你说男生为什么愿意被收割呢？其实被控制了情绪只是一个方面，更重要的是他们想要维持这段关系，因为他们觉得在前期的关系中他们是赚的！他们前期从渣女身上获得了正常妹子那里得不到的情绪价值，所以他们有欲望，有未来想要继续赚下去的欲望，所以哪怕现状出现了问题，他对未来仍抱有期待，为此他愿意加大成本投入，直至沉没成本过大，很难回头。一句话，因为有占便宜的欲望，所以被占了便宜。所有命运馈赠的礼物，早已在暗中标好了价格――茨威格那，普通妹子知道了这套逻辑就能当绿茶了吗？相关扩展阅读可参考为什么你做不成绿茶婊？https://zhuanlan.zhihu.com/p/111479699为什么世界上有渣男渣女https://www.zhihu.com/question/373717122/answer/1074861529,"两性关系,恋爱,渣男（网络用语）,渣女（网络用语）,绿茶婊（网络语言）"
li-xing-6-47,赞同了回答,1591753441,2020-06-10 09:44:01,1270552535,如何评价“吃饭时筷子插在饭上不吉”这种封建迷信思想？,因为说这话的到底是你亲爸亲妈，对着亲儿子没把话说的太露骨，而是采用了“筷子插在饭上面不吉利”这种模糊的表述。事实上准确的讲，筷子垂直插在米饭上是一些地区的葬礼习俗。在一些地区传统的灵堂，逝者的遗像前会摆放一碗白米饭，上面竖插一双筷子，表示对逝者的尊重。这种行为本身没有什么不吉利的，甚至还很庄重。简单的讲，你将一双筷子竖插在米饭上，摆到你妈面前，在你妈眼里，就跟给她敬献花圈差不多。住在你家对门儿的邻居，在他家门口摆个花圈，就对着你家门口，上面写着副对联，上联：英灵垂千古，下联：百世流芳名，都是好词儿，你表示介意，而对方则表示他觉得这样很美观，纯白的纸质花环象征着纯洁，优美的对联象昭示了主人高尚的品格，你觉得不吉利的想法是封建迷信，你无权妨碍他在门口摆什么……故事大体上跟这个差不多。将葬礼行为用在生活中，容易让人联想到死亡，而这种联想让人不愉快，于是称之为“不吉利”。天津话里面有句“倒霉孩子”，说的是“能够带来厄运的孩子”嘛？当然不是，“倒霉孩子”单纯就是“坏孩子”的意思。所以，你做了让人不愉悦的事情，对方说“不吉”，不是说你的行为能够带来厄运，而是单纯想表达，你这是不好的行为。“入乡随俗”的深层含义是，尊重当地多数人的习惯或喜好。不能插筷子的观点不是你老妈发明的，她也是遵照了你们当地习俗，你插筷子是你的自由，但是自由是有代价的，在家插筷子，你老妈可以不管你，然后你养成习惯，在你们当地用餐也公开这么做，就可能会招致周围人的反感。至于，这件事情上到底要不要尊重你们当地习俗，改变自己的习惯，或者照顾父母的感受，牺牲自己的自由。这个你自己选择，你非得这么干，我觉得，除了你老妈，别人还真懒得管你。我始终在强调，独立思维、自由意识都是很好的东西，每个人都应该保持，但是，思想是思想，行动是行动，是不是要将个人思想付诸于行动，去挑衅一个地区多数人的好恶，那就是另一回事了。我在阿拉伯国家不吃猪肉，我尊重当地习俗，并不代表我认可ysl教义，我尊重周围大多数人的忌讳，并不代表我丧失了独立思想。一个人完全可以在保持自己独立思想的同时，尊重，或者迁就他老娘“不要在饭上插筷子”这种忌讳。你跟你老娘用餐的时候让着她一会儿，等你回到自己家，自己做饭自己吃，关上门来，左手拿饭碗，右手拿筷子，只要饭受得了，你随便插，插到爽……我想题主该不会还没有自己的房子，还在跟父母一起住，吃着老娘做的饭，拿起筷子插饭，放下筷子那骂那啥吧？题主说，某些人不允许筷子竖插在米饭上，就跟msl不允许吃猪肉一样。是的，逻辑是一样的。区别是，这里是中国，吃猪肉是我们的传统，是默认被允许的，你如果在阿拉伯国家，特别是吃猪肉违法的阿拉伯国家，当着别人面吃猪肉，还叫嚣不许吃猪肉是封建迷信，挨了打我也敬你是条汉子。对msl唯唯诺诺，气自己老妈拳头倒是硬的很，一口一个迷信糟粕，一口一个封建陋习，这算什么英雄好汉？假如你老娘奉行包办婚姻，你谈个女朋友，你老娘非逼着你俩分手，我特别鼓励你跟他斗争到底。我从来不反对进步青年跟传统陋习拔刀，前提是你得是进步的。请问，挑衅所在地区多数人的无害习俗：在饭里插筷子，这个行为哪里进步了？饭里插筷子，这种做法只是你的个人行为，而本身没有任何进步性可言，道理很简单，满碗的饭你能插筷子，等吃了一半，饭浅了，筷子就插不住了。吃饭时面前竖着两个竹签子也容易发生危险，一个不注意，把筷子碰倒，碗里的东西溅的到处都是。把筷子插饭里，从始至终都不是一个安置筷子的可行性方案。中国人不是傻子，筷子作为一种使用几千年的餐具，假如在饭上插筷子是一种卫生、便捷的好习惯，古人不可能把这种方法留给死人而禁止活人用。你和你的家庭，乃至整个社会，花费巨大资源以及精力让你接受高等教育，开阔眼界，接触新鲜事物，保留独立思想，培养逻辑思维，是为了让你做一些真正有意义的事情，而不是让你在自家的餐桌上，欺负一个可能初中都没毕业的小老太太。老年人总会有一些与人无害，却又几乎没有积极意义的固有思想，照顾或者体谅这些思想的背后，是一条很现实的逻辑：每个人都会变老。你目下可能是一位眼界开阔，思想前卫的新新人类，但是你也有老的一天。你酣畅淋漓的打一场枪战游戏活到了最后，屏幕上的“大吉大利，今晚吃鸡”让你感到心情愉悦，你深深的认为这是最新潮，最爽快的娱乐形式，可难保几十年后的年轻人不会觉得“大吉大利”本身就是愚昧的迷信糟粕，然后在网上吐槽：如何看待00后老人进行有封建迷信色彩的电子游戏。真心希望到时候你能如今天这般强硬到底，而不会感到哪怕一丝丝凄凉。你可以把生活过成辩论场，然后把你老娘当成对方辩友，往死里杠，但是你心里得明白，你老娘可能没我会讲道理，没有我牙尖嘴利，但是真出了事儿，她才是内个真正向着你的人。至于现在上千条回答、评论里，那些劝你不要插筷子的人，跟那些鼓励你插筷子，并且跟你老娘刚到底的人，谁是帮你，谁在害你，你得想清楚，要连这都想不清楚，那你书真读到那啥里面了。,"习俗,调查类问题,科学,无神论,封建迷信"
li-xing-6-47,赞同了回答,1591753286,2020-06-10 09:41:26,1249707919,有什么适合情侣约会的活动？,最近小犀闺蜜谈恋爱了，老是跟我发愁说，约会不知道干嘛。热恋期还好，可是到了后来，新鲜感过了，就会觉得约会好没意思啊。其实，除了吃饭、看电影，情侣之间当然还有很多有趣的事情可以一起做！！！小犀带你走一波～1、一起拍照每天都用心搭配情侣装，不要完全一样的那种，而是颜色、元素一致的，然后拍照记录。2、一起游泳正值夏季，男生可以带女生去游泳，往她身上泼水，手把手教她学游泳，也是一种小情调呢~3、一起去看午夜场电影看午夜电影，人少很安静，有不一样的体验，但是别乱来哈 ～4、一起去买菜买回来之后，两个人可以一起收拾，然后做一顿饭，也许有各自拿手的好菜，相互品尝对方的手艺。5、一起骑单车在夏风徐徐的傍晚，可以骑着单车在城市的街道上随意逛，想去哪去哪，感受在风中奔驰的快乐。6、一起看星星如果天朗气清，找一个可以看星星的地方，搭一个帐篷，两人一起数天上的星星，从诗词歌赋谈到人生哲学（电视剧里的浪漫，你值得拥有～）7、一起去逛超市两个人一起去超市大采购，你推着车，我选着东西，买喜欢吃的零食和需要的生活用品，甜蜜就在这些日常中。8、一起养宠物不要小看一只萌宠在家里的地位，它在情侣间中可是绝对的爱情润滑剂。两个人一起给宠物起一个可爱的名字，在约会中创造一些与宠物玩耍的时光，也超级甜蜜哦~9、一起逛宜家那些单暖色调的家居，总是会让人产生幸福感。两个人在逛的同时，可以计划一下以后房子装修成什么样子，想象着这个家是多么值得期待的事情。10、一起发呆在某个慵懒的午后，彼此依靠，茶几上放着两杯咖啡，什么都不做，就这么静静地待着，也会感到相当满足。以上这10件事情，约会的小可爱们可以试一试哦~其实，小犀觉得，相爱的人在一起，做什么都是幸福的，你说呢！以上想要了解更多和结婚相关有趣好玩的事，欢迎关注【婚礼纪】喜欢小犀的分享，不要忘记给我戳个爱心赞呦~婚礼纪,"活动,恋爱,约会,恋人"
